"csv_transaction_id","unique_bank_identifier","date","memo","amount_cents"
"attwpuwsa_1","SVBFSOPERATING","2020-10-28","GRANT PLACE REST BUSBILLPAY TRAN#110 The Hack Foundation","-13905"
"attwpuwsa_1","SVBFSOPERATING","2020-12-02","TURBO CAFE AND G BUSBILLPAY TRAN#179 The Hack Foundation","-3000"
"attwpuwsa_1","SVBFSOPERATING","2020-12-02","COMBO A BUSBILLPAY TRAN#188 The Hack Foundation","-9247"
"attwpuwsa_1","SVBFSOPERATING","2020-11-19","GRANT PLACE REST BUSBILLPAY TRAN#174 The Hack Foundation","-11050"
"attwpuwsa_1","SVBFSOPERATING","2020-10-28","COMBO A BUSBILLPAY TRAN#106 The Hack Foundation","-4667"
"attwpuwsa_1","SVBFSOPERATING","2020-10-28","BODEGA . BUSBILLPAY TRAN#114 The Hack Foundation","-9400"
